[
  {
    "id": "pat-1",
    "level": 1,
    "category": "algebra",
    "title": "Algebrski sistem dveh enačb",
    "type": "system_algebra",
    "data": {
      "lines": ["A + B = 60", "A - B = 40", "A / B = ?"]
    },
    "answer": "5",
    "answers": ["5", "pet"],
    "hints": [
      "Začni s seštevanjem obeh enačb: (A + B) + (A – B) = 60 + 40, s čimer dobiš 2A = 100.",
      "Iz 2A = 100 sledi A = 50. Iz prve enačbe 50 + B = 60 nato določi B = 10.",
      "Izračunaj količnik A / B, torej 50 / 10."
    ],
    "explanation": "Z združitvijo enačb dobimo 2A = 100 → A = 50. Ker je A + B = 60, je B = 10. Količnik A / B je 50 / 10 = 5."
  },
  {
    "id": "pat-2",
    "level": 2,
    "category": "triangles",
    "title": "Trikotne relacije oglišč",
    "type": "triangle_nodes",
    "data": {
      "triangles": [
        {
          "left": 5,
          "right": 10,
          "bottom": 2
        },
        {
          "left": 4,
          "right": 32,
          "bottom": 8
        },
        {
          "left": 4,
          "right": 20,
          "bottom": "?"
        }
      ]
    },
    "answer": "5",
    "answers": ["5", "pet"],
    "hints": [
      "Opazuj odnos med levim in spodnjim številom napram desnemu številu.",
      "V prvem trikotniku velja: 5 × 2 = 10. V drugem: 4 × 8 = 32.",
      "Za tretji trikotnik izračunaj neznano število: 4 × ? = 20."
    ],
    "explanation": "Pravilo v vsakem trikotniku je: Levo število × Spodnje število = Desno število. V tretjem trikotniku: 4 × 5 = 20, zato je neznano število 5."
  },
  {
    "id": "pat-3",
    "level": 3,
    "category": "fruit",
    "title": "Sadna aritmetična enačba",
    "type": "fruit_algebra",
    "data": {
      "lines": ["🍎 + 🍎 = 10", "🍎 × 🍌 = 15", "🍌 - 🍇 = 1", "🍇 + 🍎 × 🍌 = ?"]
    },
    "answer": "17",
    "answers": ["17", "sedemnajst"],
    "hints": [
      "Iz prve vrstice izračunaj vrednost jabolka: 2 🍎 = 10 → 🍎 = 5.",
      "Vstavi jabolko v drugo vrstico: 5 × 🍌 = 15 → 🍌 = 3. Iz tretje vrstice: 3 – 🍇 = 1 → 🍇 = 2.",
      "Izračunaj končni izraz: 🍇 + 🍎 × 🍌 = 2 + 5 × 3 (pazi na prednost množenja)."
    ],
    "explanation": "🍎 = 5, 🍌 = 3, 🍇 = 2. Upoštevamo prednost množenja: 2 + (5 × 3) = 2 + 15 = 17."
  },
  {
    "id": "pat-4",
    "level": 4,
    "category": "counting",
    "title": "Prostorsko štetje kvadratov 2 × 2",
    "type": "spatial_counting",
    "data": {
      "gridSize": 2,
      "prompt": "Koliko kvadratov vseh velikosti vsebuje ta mreža?"
    },
    "answer": "5",
    "answers": ["5", "pet"],
    "hints": [
      "Najprej preštej vse posamezne male kvadrate velikosti 1 × 1.",
      "Mreža vsebuje 4 male kvadrate (1 × 1) ter 1 velik zunanji kvadrat (2 × 2).",
      "Seštej vse male in velike kvadrate skupaj."
    ],
    "explanation": "V mreži 2 × 2 imamo 4 posamezne kvadrate velikosti 1 × 1 ter 1 celoten zunanji kvadrat velikosti 2 × 2. Skupaj je 4 + 1 = 5 kvadratov."
  },
  {
    "id": "pat-5",
    "level": 5,
    "category": "wheel",
    "title": "Številčno kolo z nasprotnimi krakoma",
    "type": "wheel_spokes",
    "data": {
      "pairs": [
        {
          "top": 24,
          "bottom": 9
        },
        {
          "top": 18,
          "bottom": 15
        },
        {
          "top": 20,
          "bottom": 13
        },
        {
          "top": "?",
          "bottom": 28
        }
      ]
    },
    "answer": "5",
    "answers": ["5", "pet"],
    "hints": [
      "Primerjaj vsoto števil na nasprotnih straneh kolesa.",
      "V prvem paru je vsota: 24 + 9 = 33. V drugem paru: 18 + 15 = 33. V tretjem: 20 + 13 = 33.",
      "Poišči neznano število v zadnjem paru, da bo vsota enaka 33: ? + 28 = 33."
    ],
    "explanation": "Vsota števil na nasprotnih krakih kolesa je vedno 33. Za zadnji par velja: ? + 28 = 33 → ? = 5."
  },
  {
    "id": "pat-6",
    "level": 6,
    "category": "operators",
    "title": "Vzorčni operator Kvadratna razlika",
    "type": "operator_rule",
    "data": {
      "lines": ["4 ⊗ 2 = 14", "5 ⊗ 3 = 22", "6 ⊗ 4 = ?"]
    },
    "answer": "32",
    "answers": ["32", "dvaintrideset"],
    "hints": [
      "Prvo število najprej kvadriraj (pomnoži samo s seboj).",
      "Pri 4 ⊗ 2: 4² = 16, nato odštej 2: 16 – 2 = 14. Pri 5 ⊗ 3: 5² = 25, 25 – 3 = 22.",
      "Izračunaj vrednost po istem pravilu za 6 ⊗ 4: 6² – 4."
    ],
    "explanation": "Pravilo operatorja ⊗ je X ⊗ Y = X² – Y. Za 6 ⊗ 4 izračunamo 6² – 4 = 36 – 4 = 32."
  },
  {
    "id": "pat-7",
    "level": 7,
    "category": "pyramid",
    "title": "Piramida opeke (3 nivoji)",
    "type": "pyramid_bricks",
    "data": {
      "bottom": [3, 4, 5],
      "prompt": "Dopolni številsko piramido. Katero število je na vrhu?",
      "middle": [7, null]
    },
    "answer": "16",
    "answers": ["16", "šestnajst"],
    "hints": [
      "Opazi, da je leva sredinska opeka 7 že izpolnjena – kako je dobljena iz 3 in 4?",
      "Druga sredinska opeka je vsota 4 + 5 = 9.",
      "Vrh piramide je vsota obeh sredinskih opek: 7 + 9."
    ],
    "explanation": "Sredinski nivo: 3+4=7 (že prikazano) in 4+5=9. Vrh = 7+9=16. Skrito pravilo je seštevanje dveh sosednjih opek."
  },
  {
    "id": "pat-8",
    "level": 8,
    "category": "domino",
    "title": "Zaporedje domino ploščic",
    "type": "domino_tiles",
    "data": {
      "tiles": [
        {
          "top": 2,
          "bottom": 4
        },
        {
          "top": 3,
          "bottom": 5
        },
        {
          "top": 4,
          "bottom": 6
        },
        {
          "top": 5,
          "bottom": "?"
        }
      ]
    },
    "answer": "7",
    "answers": ["7", "sedem"],
    "hints": [
      "Opazuj razliko ali vsoto pik med zgornjim in spodnjim delom ploščice.",
      "V vsaki ploščici je spodnje število za 2 večje od zgornjega (4-2=2, 5-3=2, 6-4=2).",
      "Za zadnjo ploščico s število 5 zgoraj izračunaj: 5 + 2."
    ],
    "explanation": "Spodnje število domino ploščice je vedno za 2 večje od zgornjega. Za 5 zgoraj dobimo 5 + 2 = 7."
  },
  {
    "id": "pat-9",
    "level": 9,
    "category": "algebra",
    "title": "Sistem treh simbolnih enačb",
    "type": "system_algebra",
    "data": {
      "lines": ["X + X + X = 30", "X + Y + Y = 20", "Y + Z + Z = 9", "X + Y × Z = ?"]
    },
    "answer": "20",
    "answers": ["20", "dvajset"],
    "hints": [
      "Iz prve enačbe (3X = 30) izračunaj vrednost X = 10.",
      "Vstavi X v drugo enačbo: 10 + 2Y = 20 → Y = 5. Nato iz tretje: 5 + 2Z = 9 → Z = 2.",
      "Izračunaj končni izraz X + Y × Z (pazi na prednost množenja): 10 + 5 × 2."
    ],
    "explanation": "X = 10, Y = 5, Z = 2. Upoštevamo prednost operacije množenja: X + Y × Z = 10 + (5 × 2) = 10 + 10 = 20."
  },
  {
    "id": "pat-10",
    "level": 10,
    "category": "triangles",
    "title": "Pitagorejski trikotni vzorec",
    "type": "triangle_nodes",
    "data": {
      "triangles": [
        {
          "left": 3,
          "right": 4,
          "bottom": 25
        },
        {
          "left": 5,
          "right": 12,
          "bottom": 169
        },
        {
          "left": 6,
          "right": 8,
          "bottom": "?"
        }
      ]
    },
    "answer": "100",
    "answers": ["100", "sto"],
    "hints": [
      "Kvadriraj levo in desno število ter ju seštej.",
      "V 1. trikotniku: 3² + 4² = 9 + 16 = 25. V 2. trikotniku: 5² + 12² = 25 + 144 = 169.",
      "Za 3. trikotnik izračunaj: 6² + 8²."
    ],
    "explanation": "Spodnje število je vsota kvadratov obeh zgornjih števil: 6² + 8² = 36 + 64 = 100."
  },
  {
    "id": "pat-11",
    "level": 11,
    "category": "clocks",
    "title": "Časovno zaporedje ure",
    "type": "clock_faces",
    "data": {
      "clocks": [1, 3, 5, "?"]
    },
    "answer": "7",
    "answers": ["7", "sedem"],
    "hints": [
      "Opazuj premik stenskih ur v zaporedju.",
      "Vsaka ura se premakne za natanko 2 uri naprej: 1:00 → 3:00 → 5:00.",
      "Dodaj 2 uri h 5:00 za določitev četrt ure."
    ],
    "explanation": "Zaporedje ur narašča za +2 uri: 1:00, 3:00, 5:00, 7:00. Odgovor je 7."
  },
  {
    "id": "pat-12",
    "level": 12,
    "category": "pie",
    "title": "Krožni izseki potenc",
    "type": "pie_sectors",
    "data": {
      "sectors": [
        {
          "left": 4,
          "right": 16
        },
        {
          "left": 5,
          "right": 25
        },
        {
          "left": 6,
          "right": "?"
        }
      ]
    },
    "answer": "36",
    "answers": ["36", "šestintrideset"],
    "hints": [
      "Primerjaj desni izsek z levim izsekom kroga.",
      "Desni izsek je kvadrat levega izseka: 4² = 16 in 5² = 25.",
      "Za tretji krog z vrednostjo 6 izračunaj: 6²."
    ],
    "explanation": "Desni del krožnega izseka je kvadrat levega dela: 6² = 36."
  },
  {
    "id": "pat-13",
    "level": 13,
    "category": "counting",
    "title": "Prostorsko štetje kvadratov 3 × 3",
    "type": "spatial_counting",
    "data": {
      "gridSize": 3,
      "prompt": "Koliko kvadratov vseh velikosti vsebuje ta mreža?"
    },
    "answer": "14",
    "answers": ["14", "štirinajst"],
    "hints": [
      "Preštej kvadrate po velikostih: 1 × 1, 2 × 2 in 3 × 3.",
      "Kvadratov 1 × 1 je 9, kvadratov 2 × 2 je 4, zunanji kvadrat 3 × 3 pa je 1.",
      "Seštej vse tri skupine kvadratov: 9 + 4 + 1."
    ],
    "explanation": "Število kvadratov v mreži 3 × 3 izračunamo kot vsoto kvadratov dimenzij: 3² + 2² + 1² = 9 + 4 + 1 = 14 kvadratov."
  },
  {
    "id": "pat-14",
    "level": 14,
    "category": "matrix",
    "title": "Matrika – potence",
    "type": "matrix_grid",
    "data": {
      "rows": [
        [2, 4, 8],
        [3, 9, 27],
        [4, 16, "?"]
      ]
    },
    "answer": "64",
    "answers": ["64", "štiriinšestdeset"],
    "hints": [
      "Opazuj napredovanje števil v posamezni vrstici.",
      "Prva vrstica: 2¹=2, 2²=4, 2³=8. Druga vrstica: 3¹=3, 3²=9, 3³=27.",
      "Tretja vrstica sledi vzorcu potenc števila 4: 4¹=4, 4²=16, 4³=?"
    ],